{
 "schema": "n1.0",
 "policy_id": "sheet-1.0",
 "ticker": "ELF",
 "date": "2026-10-16",
 "generated": "2026-10-17T02:23:51+00:00",
 "E": 100000.0,
 "direction": null,
 "liquidity": {
  "can_price": false,
  "failing": "L4",
  "contracts": 336,
  "hot_chain_days": 1,
  "adv_usd": 131730444.84390259,
  "atm_spread": null,
  "tier": null,
  "atm_strike": null,
  "atm_expiry": "2026-11-13",
  "verdicts": {
   "L1": true,
   "L2": true,
   "L3": true,
   "L4": false,
   "L5": true,
   "L6": false
  },
  "source": {
   "issue_type": "screener 2026-10-16",
   "close": "screener 2026-10-16",
   "contracts": "daily_contract 2026-10-16",
   "hot_chain_days": "daily_contract 2026-09-18..2026-10-16 (21 sessions)",
   "adv_usd": "prices.parquet 20 sessions to 2026-10-16",
   "atm_spread": "daily_contract late window 2026-10-16",
   "tier": "engine.marking.print_mark late, daily_contract 2026-10-16"
  },
  "nulls": [
   {
    "field": "liquidity.atm_spread",
    "reason": "no ATM pair within 2.5% of 113.48 at 2026-11-13 with 5+ lots on both legs"
   }
  ]
 },
 "events": {
  "earnings": {
   "date": "2026-11-03",
   "session": "unknown",
   "session_date": "2026-11-04",
   "sources": [
    {
     "name": "finnhub",
     "date": "2026-11-03",
     "hour": null
    },
    {
     "name": "screener",
     "date": "2026-11-04",
     "hour": "unknown"
    },
    {
     "name": "yfinance",
     "date": "2026-11-04",
     "hour": null
    }
   ],
   "confirmed": true,
   "days_to": 19
  },
  "ex_div": null,
  "expiries": [
   "2026-10-23",
   "2026-10-30"
  ],
  "macro": [
   {
    "date": "2026-10-28",
    "event": "FOMC"
   }
  ],
  "x1_window_end": "2026-11-04",
  "source": {
   "earnings": "finnhub /calendar/earnings + screener 2026-10-16 + yfinance calendar",
   "ex_div": "screener 2026-10-16",
   "expiries": "cboe_chain 2026-10-16",
   "macro": "FOMC published calendar (engine.name.data.FOMC_DATES)"
  },
  "nulls": [
   {
    "field": "events.ex_div",
    "reason": "screener next_dividend_date is not a date: 'NaT'"
   }
  ]
 },
 "premium": {
  "iv30d": 0.684,
  "iv_pct_own": 61.111111111111114,
  "rv5_21": 36.759601007628376,
  "rv_c2c_21": 35.75220246658869,
  "spread_rv5": 31.64039899237163,
  "spread_c2c": 32.647797533411314,
  "slope": -1.8449999999999966,
  "earnings_history": [
   {
    "E": "2026-05-20",
    "implied_move": 0.1197588920981047,
    "implied_source": "screener implied_move_perc",
    "realized_move": 0.04731856572199766,
    "ratio": 0.39511525944340736
   },
   {
    "E": "2026-08-05",
    "implied_move": 0.1155314865286689,
    "implied_source": "screener implied_move_perc",
    "realized_move": 0.06877381756534429,
    "ratio": 0.5952820277117978
   }
  ],
  "median_ratio_8": 0.49519864357760257,
  "sc": {
   "pass": false,
   "failing": "F5",
   "expiry": "2026-11-13",
   "dte_cal": 28,
   "sigma_hold": null,
   "verdicts": {
    "F1": true,
    "F2": true,
    "F3": true,
    "F4": true,
    "F5": false,
    "F6": true,
    "F7": true,
    "F8": null,
    "F9": null
   }
  },
  "sa": {
   "window_days": 30,
   "days_to": 19,
   "timing": "unknown",
   "filters": {
    "F1": true,
    "F2": true,
    "F3": true,
    "F4": true,
    "F7": true,
    "F8": false
   },
   "first_fail": "F8",
   "note": "S-A is closed at retail execution (market-analysis RESEARCH/48 G1, D23); no earnings trade is recommended",
   "source": "engine.strategies.sa_filters.cheap_filters on SA_PARAMS, screener 2026-10-16"
  },
  "x1": true,
  "verdict": "FAIR",
  "source": {
   "iv30d": "screener 2026-10-16 (a decimal, as the screener carries it)",
   "iv_pct_own": "screener 2026-03-23..2026-10-16 (126 sessions)",
   "rv5_21": "intraday_rv rv5, 21 quality sessions 2026-09-18..2026-10-16 (the panel lags the sheet date)",
   "rv_c2c_21": "daily bars close-to-close, 21 returns 2026-09-18..2026-10-16",
   "spread_rv5": "vol points: 100 x iv30d (screener 2026-10-16) - rv5_21 (intraday_rv rv5, 21 quality sessions 2026-09-18..2026-10-16 (the panel lags the sheet date))",
   "spread_c2c": "vol points: 100 x iv30d (screener 2026-10-16) - rv_c2c_21 (daily bars close-to-close, 21 returns 2026-09-18..2026-10-16)",
   "slope": "cboe_chain 2026-10-16 ATM IV at 2026-10-23 then 2026-10-30, vol points",
   "earnings_history": "earnings_events <= 2026-08-05 + earnings_history/events.parquet <= 2026-08-05",
   "sc": "engine.strategies.sc_filters.evaluate_name on SC_PARAMS, daily_contract 2026-10-16",
   "sa": "engine.strategies.sa_filters.cheap_filters on SA_PARAMS, screener 2026-10-16"
  },
  "nulls": []
 },
 "range": {
  "straddle_front": {
   "expiry": "2026-10-23",
   "strike": 113.0,
   "mark": 6.4399999999999995,
   "mark_source": "cboe_chain 2026-10-16",
   "tier": null
  },
  "box_1s_front": 6.4399999999999995,
  "box_1s_21": 22.253054111282104,
  "atr14": 4.256047166616752,
  "gex_total": 6442597.9492,
  "gex_sign": "+",
  "zero_gamma": 110.0,
  "zero_gamma_all_crossings": [
   90.0,
   100.0,
   110.0
  ],
  "spot": 113.48,
  "source": {
   "straddle_front": "cboe_chain 2026-10-16",
   "box_1s_front": "cboe_chain 2026-10-16",
   "box_1s_21": "screener 2026-10-16",
   "atr14": "earnings_history/bars <= 2026-10-16",
   "gex_total": "cboe_chain 2026-10-16",
   "gex_sign": "cboe_chain 2026-10-16",
   "zero_gamma": "cboe_chain 2026-10-16",
   "spot": "screener 2026-10-16"
  },
  "nulls": []
 },
 "flags": {
  "borrow": {
   "fee": 0.4099,
   "available": 1400000.0,
   "date": "2026-10-16",
   "decile": 0.3545725244776421,
   "stale_days": 0
  },
  "si": {
   "pct_float": 0.0722,
   "dtc": 3.15,
   "settlement": "2026-09-30",
   "publication": "2026-10-13",
   "position": 4108333.0
  },
  "beta_250": 1.7296732743430792,
  "beta_n": 249,
  "analyst": [
   {
    "date": "2026-10-07",
    "firm": "Baird",
    "from": "Outperform",
    "to": "Outperform",
    "action": "main"
   },
   {
    "date": "2026-10-14",
    "firm": "Citigroup",
    "from": "Buy",
    "to": "Buy",
    "action": "main"
   },
   {
    "date": "2026-10-15",
    "firm": "Morgan Stanley",
    "from": "Equal-Weight",
    "to": "Equal-Weight",
    "action": "main"
   }
  ],
  "analyst_n": 3,
  "form4": {
   "buys": 0,
   "sells": 4,
   "other": 2,
   "rows": [
    {
     "date": "2026-10-12",
     "name": "Franks Joshua Allen",
     "code": "S",
     "shares": -8366.0,
     "price": 110.006
    },
    {
     "date": "2026-10-01",
     "name": "AMIN TARANG",
     "code": "M",
     "shares": -71000.0,
     "price": 0.0
    },
    {
     "date": "2026-10-01",
     "name": "AMIN TARANG",
     "code": "S",
     "shares": -2026.0,
     "price": 105.0077
    },
    {
     "date": "2026-10-01",
     "name": "AMIN TARANG",
     "code": "S",
     "shares": -21902.0,
     "price": 103.6574
    },
    {
     "date": "2026-10-01",
     "name": "AMIN TARANG",
     "code": "S",
     "shares": -23072.0,
     "price": 102.8351
    },
    {
     "date": "2026-10-01",
     "name": "AMIN TARANG",
     "code": "M",
     "shares": 71000.0,
     "price": 26.84
    }
   ]
  },
  "vix": {
   "vix": 19.99,
   "vix3m": 20.5,
   "vxn": 27.13,
   "term": "contango",
   "date": "2026-10-16"
  },
  "regime": "CHOP",
  "regime_asof": "2026-10-16",
  "regime_stale": false,
  "x2": false,
  "x2_reason": null,
  "x5": false,
  "source": {
   "borrow": "borrow (IBKR) 2026-10-16",
   "si": "short_interest (FINRA) settlement 2026-09-30, published 2026-10-13 + short float finviz fz quote",
   "beta_250": "earnings_history/bars x SPY 250 sessions to 2026-10-16",
   "analyst": "yfinance upgrades_downgrades <= 2026-10-16",
   "form4": "finnhub /stock/insider-transactions <= 2026-10-16",
   "vix": "index_vol 2026-10-16",
   "regime": "_regime.classify_regime asof 2026-10-16",
   "x2": "borrow (IBKR) 2026-10-16",
   "x5": "short float finviz fz quote"
  },
  "nulls": []
 },
 "context": {
  "ret_21": 0.2166738243337627,
  "ret_63": 0.42548648763851316,
  "w52_pos": 0.6983167998229796,
  "flow_pct_universe": 6.862911435357991,
  "flow_pct_self": 32.53968253968254,
  "vol_pct_universe": 75.97904500171762,
  "vol_pct_self": 88.0952380952381,
  "net_premium": -219283.0,
  "volume_ratio": 1.0450886717915027,
  "universe_n": 5894,
  "self_n": 63,
  "sentence": "Direction: no input on this sheet has a measured directional edge at 1\u20134 weeks; the engine emits none.",
  "source": {
   "ret_21": "earnings_history/bars <= 2026-10-16",
   "ret_63": "earnings_history/bars <= 2026-10-16",
   "w52_pos": "earnings_history/bars 252 sessions to 2026-10-16",
   "net_premium": "screener 2026-10-16",
   "volume_ratio": "screener 2026-10-16",
   "flow_pct_universe": "screener universe 2026-10-16",
   "vol_pct_universe": "screener universe 2026-10-16",
   "flow_pct_self": "screener 63 sessions to 2026-10-16",
   "vol_pct_self": "screener 63 sessions to 2026-10-16",
   "sentence": "DESIGN/70 \u00a74F, DECISIONS D3 (frozen 2026-09-20)"
  },
  "nulls": []
 },
 "structures": [],
 "ledger_rows": [],
 "context_read": "none",
 "inputs_dir": "analyses/ticker/ELF/2026-10-16/inputs",
 "nulls": [
  {
   "field": "liquidity.atm_spread",
   "reason": "no ATM pair within 2.5% of 113.48 at 2026-11-13 with 5+ lots on both legs"
  },
  {
   "field": "events.ex_div",
   "reason": "screener next_dividend_date is not a date: 'NaT'"
  }
 ]
}