{
 "schema": "n1.0",
 "policy_id": "sheet-1.0",
 "ticker": "BE",
 "date": "2026-10-30",
 "generated": "2026-10-31T14:07:55+00:00",
 "E": 100000.0,
 "direction": null,
 "liquidity": {
  "can_price": false,
  "failing": "L6",
  "contracts": 1436,
  "hot_chain_days": 21,
  "adv_usd": 3530694082.074127,
  "atm_spread": null,
  "tier": null,
  "atm_strike": null,
  "atm_expiry": "2026-11-27",
  "verdicts": {
   "L1": true,
   "L2": true,
   "L3": true,
   "L4": true,
   "L5": true,
   "L6": false
  },
  "source": {
   "issue_type": "screener 2026-10-30",
   "close": "screener 2026-10-30",
   "contracts": "daily_contract 2026-10-30",
   "hot_chain_days": "daily_contract 2026-10-02..2026-10-30 (21 sessions)",
   "adv_usd": "prices.parquet 20 sessions to 2026-10-30",
   "atm_spread": "daily_contract late window 2026-10-30",
   "tier": "engine.marking.print_mark late, daily_contract 2026-10-30"
  },
  "nulls": [
   {
    "field": "liquidity.atm_spread",
    "reason": "no ATM pair within 2.5% of 203.08 at 2026-11-27 with 5+ lots on both legs"
   }
  ]
 },
 "events": {
  "earnings": {
   "date": "2027-02-03",
   "session": "post",
   "session_date": "2027-02-04",
   "sources": [
    {
     "name": "finnhub",
     "date": "2027-02-03",
     "hour": "amc"
    },
    {
     "name": "screener",
     "date": "2027-02-04",
     "hour": "unknown"
    },
    {
     "name": "yfinance",
     "date": "2026-10-22",
     "hour": null
    }
   ],
   "confirmed": false,
   "days_to": 97
  },
  "ex_div": null,
  "expiries": [
   "2026-11-06",
   "2026-11-13"
  ],
  "macro": [
   {
    "date": "2026-12-09",
    "event": "FOMC"
   }
  ],
  "x1_window_end": "2026-12-14",
  "source": {
   "earnings": "finnhub /calendar/earnings + screener 2026-10-30 + yfinance calendar",
   "ex_div": "screener 2026-10-30",
   "expiries": "cboe_chain 2026-10-30",
   "macro": "FOMC published calendar (engine.name.data.FOMC_DATES)"
  },
  "nulls": [
   {
    "field": "events.earnings.confirmed",
    "reason": "the earnings sources disagree on the session: finnhub 2027-02-03 amc, screener 2027-02-04 unknown, yfinance 2026-10-22 None"
   },
   {
    "field": "events.ex_div",
    "reason": "screener next_dividend_date is not a date: 'NaT'"
   }
  ]
 },
 "premium": {
  "iv30d": 0.834,
  "iv_pct_own": 26.190476190476193,
  "rv5_21": 59.784966296499285,
  "rv_c2c_21": 90.19465944472287,
  "spread_rv5": 23.615033703500707,
  "spread_c2c": -6.794659444722882,
  "slope": -3.1750000000000056,
  "earnings_history": [
   {
    "E": "2026-04-28",
    "implied_move": 0.1260387781557915,
    "implied_source": "screener implied_move_perc",
    "realized_move": 0.27212089690432006,
    "ratio": 2.159025189596509
   },
   {
    "E": "2026-07-28",
    "implied_move": 0.1891218985368969,
    "implied_source": "screener implied_move_perc",
    "realized_move": 0.018520716888728805,
    "ratio": 0.0979300495183824
   }
  ],
  "median_ratio_8": 1.1284776195574457,
  "sc": {
   "pass": false,
   "failing": "F3",
   "expiry": null,
   "dte_cal": null,
   "sigma_hold": null,
   "verdicts": {
    "F1": true,
    "F2": true,
    "F3": false,
    "F4": true,
    "F5": null,
    "F6": false,
    "F7": null,
    "F8": null,
    "F9": null
   }
  },
  "sa": null,
  "x1": true,
  "verdict": "CHEAP",
  "source": {
   "iv30d": "screener 2026-10-30 (a decimal, as the screener carries it)",
   "iv_pct_own": "screener 2026-05-04..2026-10-30 (126 sessions)",
   "rv5_21": "intraday_rv rv5, 21 quality sessions 2026-10-02..2026-10-30 (the panel lags the sheet date)",
   "rv_c2c_21": "daily bars close-to-close, 21 returns 2026-10-02..2026-10-30",
   "spread_rv5": "vol points: 100 x iv30d (screener 2026-10-30) - rv5_21 (intraday_rv rv5, 21 quality sessions 2026-10-02..2026-10-30 (the panel lags the sheet date))",
   "spread_c2c": "vol points: 100 x iv30d (screener 2026-10-30) - rv_c2c_21 (daily bars close-to-close, 21 returns 2026-10-02..2026-10-30)",
   "slope": "cboe_chain 2026-10-30 ATM IV at 2026-11-06 then 2026-11-13, vol points",
   "earnings_history": "earnings_events <= 2026-07-28 + earnings_history/events.parquet <= 2026-07-28",
   "sc": "engine.strategies.sc_filters.evaluate_name on SC_PARAMS, daily_contract 2026-10-30",
   "sa": "engine.strategies.sa_filters.cheap_filters on SA_PARAMS, screener 2026-10-30"
  },
  "nulls": []
 },
 "range": {
  "straddle_front": {
   "expiry": "2026-11-06",
   "strike": 202.5,
   "mark": 20.95,
   "mark_source": "cboe_chain 2026-10-30",
   "tier": null
  },
  "box_1s_front": 20.95,
  "box_1s_21": 48.55650287087952,
  "atr14": 19.708300440341507,
  "gex_total": -16155531.123503998,
  "gex_sign": "-",
  "zero_gamma": null,
  "zero_gamma_all_crossings": [],
  "spot": 203.08,
  "source": {
   "straddle_front": "cboe_chain 2026-10-30",
   "box_1s_front": "cboe_chain 2026-10-30",
   "box_1s_21": "screener 2026-10-30",
   "atr14": "earnings_history/bars <= 2026-10-30",
   "gex_total": "cboe_chain 2026-10-30",
   "gex_sign": "cboe_chain 2026-10-30",
   "zero_gamma": "cboe_chain 2026-10-30",
   "spot": "screener 2026-10-30"
  },
  "nulls": [
   {
    "field": "zero_gamma",
    "reason": "cumulative GEX never changes sign over the listed strikes"
   }
  ]
 },
 "flags": {
  "borrow": {
   "fee": 0.4135,
   "available": 7800000.0,
   "date": "2026-10-30",
   "decile": 0.36600737345556,
   "stale_days": 0
  },
  "si": {
   "pct_float": 0.061799999999999994,
   "dtc": 1.33,
   "settlement": "2026-10-15",
   "publication": "2026-10-28",
   "position": 17191709.0
  },
  "beta_250": 4.4808444014360935,
  "beta_n": 249,
  "analyst": [
   {
    "date": "2026-10-23",
    "firm": "JP Morgan",
    "from": "Overweight",
    "to": "Overweight",
    "action": "main"
   },
   {
    "date": "2026-10-23",
    "firm": "RBC Capital",
    "from": "Outperform",
    "to": "Outperform",
    "action": "reit"
   },
   {
    "date": "2026-10-23",
    "firm": "Keybanc",
    "from": "Sector Weight",
    "to": "Sector Weight",
    "action": "reit"
   },
   {
    "date": "2026-10-23",
    "firm": "Morgan Stanley",
    "from": "Overweight",
    "to": "Overweight",
    "action": "main"
   },
   {
    "date": "2026-10-23",
    "firm": "Bernstein",
    "from": "Market Perform",
    "to": "Market Perform",
    "action": "main"
   },
   {
    "date": "2026-10-23",
    "firm": "BTIG",
    "from": "Buy",
    "to": "Buy",
    "action": "main"
   },
   {
    "date": "2026-10-26",
    "firm": "Barclays",
    "from": "Equal-Weight",
    "to": "Equal-Weight",
    "action": "main"
   },
   {
    "date": "2026-10-26",
    "firm": "Wells Fargo",
    "from": "Equal-Weight",
    "to": "Equal-Weight",
    "action": "main"
   },
   {
    "date": "2026-10-29",
    "firm": "Citigroup",
    "from": "Neutral",
    "to": "Neutral",
    "action": "main"
   }
  ],
  "analyst_n": 9,
  "form4": {
   "buys": 0,
   "sells": 1,
   "other": 0,
   "rows": [
    {
     "date": "2026-10-01",
     "name": "Joshi Aman",
     "code": "S",
     "shares": -8437.0,
     "price": 277.17
    }
   ]
  },
  "vix": {
   "vix": 19.42,
   "vix3m": 20.78,
   "vxn": 28.5,
   "term": "contango",
   "date": "2026-10-30"
  },
  "regime": "CHOP",
  "regime_asof": "2026-10-30",
  "regime_stale": false,
  "x2": false,
  "x2_reason": null,
  "x5": false,
  "source": {
   "borrow": "borrow (IBKR) 2026-10-30",
   "si": "short_interest (FINRA) settlement 2026-10-15, published 2026-10-28 + short float finviz fz quote",
   "beta_250": "earnings_history/bars x SPY 250 sessions to 2026-10-30",
   "analyst": "yfinance upgrades_downgrades <= 2026-10-30",
   "form4": "finnhub /stock/insider-transactions <= 2026-10-30",
   "vix": "index_vol 2026-10-30",
   "regime": "_regime.classify_regime asof 2026-10-30",
   "x2": "borrow (IBKR) 2026-10-30",
   "x5": "short float finviz fz quote"
  },
  "nulls": []
 },
 "context": {
  "ret_21": -0.2680668347966373,
  "ret_63": -0.06939359035827963,
  "w52_pos": 0.4625517104787925,
  "flow_pct_universe": 0.3829787234042553,
  "flow_pct_self": 10.317460317460318,
  "vol_pct_universe": 65.0879917184265,
  "vol_pct_self": 83.33333333333333,
  "net_premium": -12255416.0,
  "volume_ratio": 1.0302510837038144,
  "universe_n": 5875,
  "self_n": 63,
  "sentence": "Direction: no input on this sheet has a measured directional edge at 1\u20134 weeks; the engine emits none.",
  "source": {
   "ret_21": "earnings_history/bars <= 2026-10-30",
   "ret_63": "earnings_history/bars <= 2026-10-30",
   "w52_pos": "earnings_history/bars 252 sessions to 2026-10-30",
   "net_premium": "screener 2026-10-30",
   "volume_ratio": "screener 2026-10-30",
   "flow_pct_universe": "screener universe 2026-10-30",
   "vol_pct_universe": "screener universe 2026-10-30",
   "flow_pct_self": "screener 63 sessions to 2026-10-30",
   "vol_pct_self": "screener 63 sessions to 2026-10-30",
   "sentence": "DESIGN/70 \u00a74F, DECISIONS D3 (frozen 2026-09-20)"
  },
  "nulls": []
 },
 "structures": [],
 "ledger_rows": [],
 "context_read": "none",
 "inputs_dir": "analyses/ticker/BE/2026-10-30/inputs",
 "nulls": [
  {
   "field": "liquidity.atm_spread",
   "reason": "no ATM pair within 2.5% of 203.08 at 2026-11-27 with 5+ lots on both legs"
  },
  {
   "field": "events.earnings.confirmed",
   "reason": "the earnings sources disagree on the session: finnhub 2027-02-03 amc, screener 2027-02-04 unknown, yfinance 2026-10-22 None"
  },
  {
   "field": "events.ex_div",
   "reason": "screener next_dividend_date is not a date: 'NaT'"
  },
  {
   "field": "range.zero_gamma",
   "reason": "cumulative GEX never changes sign over the listed strikes"
  }
 ]
}