{
 "schema": "n1.0",
 "policy_id": "sheet-1.0",
 "ticker": "RKT",
 "date": "2026-09-18",
 "generated": "2026-09-21T02:54:18+00:00",
 "E": 100000.0,
 "direction": null,
 "liquidity": {
  "can_price": false,
  "failing": "L3",
  "contracts": 275,
  "hot_chain_days": 21,
  "adv_usd": 340349115.08250237,
  "atm_spread": 0.0698049707126716,
  "tier": 1,
  "atm_strike": 12.0,
  "atm_expiry": "2026-10-16",
  "verdicts": {
   "L1": true,
   "L2": true,
   "L3": false,
   "L4": true,
   "L5": true,
   "L6": true
  },
  "source": {
   "issue_type": "screener 2026-09-18",
   "close": "screener 2026-09-18",
   "contracts": "daily_contract 2026-09-18",
   "hot_chain_days": "daily_contract 2026-08-20..2026-09-18 (21 sessions)",
   "adv_usd": "prices.parquet 20 sessions to 2026-09-18",
   "atm_spread": "daily_contract late window 2026-09-18",
   "tier": "engine.marking.print_mark late, daily_contract 2026-09-18"
  },
  "nulls": []
 },
 "events": {
  "earnings": {
   "date": "2026-10-28",
   "session": "post",
   "session_date": "2026-10-29",
   "sources": [
    {
     "name": "finnhub",
     "date": "2026-10-28",
     "hour": "amc"
    },
    {
     "name": "screener",
     "date": "2026-10-29",
     "hour": "unknown"
    },
    {
     "name": "yfinance",
     "date": "2026-11-05",
     "hour": null
    }
   ],
   "confirmed": false,
   "days_to": 41
  },
  "ex_div": null,
  "expiries": [
   "2026-09-25",
   "2026-10-02"
  ],
  "macro": [
   {
    "date": "2026-10-28",
    "event": "FOMC"
   }
  ],
  "x1_window_end": "2026-11-02",
  "source": {
   "earnings": "finnhub /calendar/earnings + screener 2026-09-18 + yfinance calendar",
   "ex_div": "screener 2026-09-18",
   "expiries": "cboe_chain 2026-09-18",
   "macro": "FOMC published calendar (engine.name.data.FOMC_DATES)"
  },
  "nulls": [
   {
    "field": "events.earnings.confirmed",
    "reason": "the earnings sources disagree on the session: finnhub 2026-10-28 amc, screener 2026-10-29 unknown, yfinance 2026-11-05 None"
   }
  ]
 },
 "premium": {
  "iv30d": 0.542703603076857,
  "iv_pct_own": 20.535714285714285,
  "rv5_21": 42.94550642396556,
  "rv_c2c_21": 38.69906738820444,
  "spread_rv5": 11.324853883720145,
  "spread_c2c": 15.571292919481266,
  "slope": 2.649999999999997,
  "earnings_history": [
   {
    "E": "2026-05-07",
    "implied_move": 0.0798675428152174,
    "implied_source": "screener implied_move_perc",
    "realized_move": 0.10883392249963775,
    "ratio": 1.3626802411016619
   },
   {
    "E": "2026-08-06",
    "implied_move": 0.0649655542597422,
    "implied_source": "screener implied_move_perc",
    "realized_move": 0.03782148183816747,
    "ratio": 0.5821774672613647
   }
  ],
  "median_ratio_8": 0.9724288541815133,
  "sc": {
   "pass": false,
   "failing": "F3",
   "expiry": null,
   "dte_cal": null,
   "sigma_hold": null,
   "verdicts": {
    "F1": true,
    "F2": true,
    "F3": false,
    "F4": true,
    "F5": null,
    "F6": true,
    "F7": null,
    "F8": null,
    "F9": null
   }
  },
  "sa": null,
  "x1": true,
  "verdict": "FAIR",
  "source": {
   "iv30d": "screener 2026-09-18 (a decimal, as the screener carries it)",
   "iv_pct_own": "screener 2026-03-13..2026-09-18 (112 sessions)",
   "rv5_21": "intraday_rv rv5, 21 quality sessions 2026-08-07..2026-09-04 (the panel lags the sheet date)",
   "rv_c2c_21": "daily bars close-to-close, 21 returns 2026-08-20..2026-09-18",
   "spread_rv5": "vol points: 100 x iv30d (screener 2026-09-18) - rv5_21 (intraday_rv rv5, 21 quality sessions 2026-08-07..2026-09-04 (the panel lags the sheet date))",
   "spread_c2c": "vol points: 100 x iv30d (screener 2026-09-18) - rv_c2c_21 (daily bars close-to-close, 21 returns 2026-08-20..2026-09-18)",
   "slope": "cboe_chain 2026-09-18 ATM IV at 2026-09-25 then 2026-10-02, vol points",
   "earnings_history": "earnings_events <= 2026-08-06 + earnings_history/events.parquet <= 2026-08-06",
   "sc": "engine.strategies.sc_filters.evaluate_name on SC_PARAMS, daily_contract 2026-09-18",
   "sa": "engine.strategies.sa_filters.cheap_filters on SA_PARAMS, screener 2026-09-18"
  },
  "nulls": []
 },
 "range": {
  "straddle_front": {
   "expiry": "2026-09-25",
   "strike": 12.5,
   "mark": 0.715,
   "mark_source": "cboe_chain 2026-09-18",
   "tier": null
  },
  "box_1s_front": 0.715,
  "box_1s_21": 1.9121800504703577,
  "atr14": 0.6437185084650169,
  "gex_total": 42709610.25869999,
  "gex_sign": "+",
  "zero_gamma": 15.0,
  "zero_gamma_all_crossings": [
   15.0
  ],
  "spot": 12.29,
  "source": {
   "straddle_front": "cboe_chain 2026-09-18",
   "box_1s_front": "cboe_chain 2026-09-18",
   "box_1s_21": "screener 2026-09-18",
   "atr14": "earnings_history/bars <= 2026-09-18",
   "gex_total": "cboe_chain 2026-09-18",
   "gex_sign": "cboe_chain 2026-09-18",
   "zero_gamma": "cboe_chain 2026-09-18",
   "spot": "screener 2026-09-18"
  },
  "nulls": []
 },
 "flags": {
  "borrow": {
   "fee": 0.4135,
   "available": 5400000.0,
   "date": "2026-09-18",
   "decile": 0.35775839958963834,
   "stale_days": 0
  },
  "si": {
   "pct_float": 0.0596,
   "dtc": 5.13,
   "settlement": "2026-08-31",
   "publication": "2026-09-14",
   "position": 109373564.0
  },
  "beta_250": 2.1609995515304683,
  "beta_n": 249,
  "analyst": [],
  "analyst_n": 0,
  "form4": {
   "buys": 0,
   "sells": 0,
   "other": 0,
   "rows": []
  },
  "vix": {
   "vix": 14.81,
   "vix3m": 18.24,
   "vxn": 19.29,
   "term": "contango",
   "date": "2026-09-18"
  },
  "regime": "CHOP",
  "regime_asof": "2026-09-04",
  "regime_stale": true,
  "x2": false,
  "x2_reason": null,
  "x5": false,
  "source": {
   "borrow": "borrow (IBKR) 2026-09-18",
   "si": "short_interest (FINRA) settlement 2026-08-31, published 2026-09-14 + short float finviz fz quote",
   "beta_250": "earnings_history/bars x SPY 250 sessions to 2026-09-18",
   "analyst": "yfinance upgrades_downgrades <= 2026-09-18",
   "form4": "finnhub /stock/insider-transactions <= 2026-09-18",
   "vix": "index_vol 2026-09-18",
   "regime": "_regime.classify_regime asof 2026-09-04",
   "x2": "borrow (IBKR) 2026-09-18",
   "x5": "short float finviz fz quote"
  },
  "nulls": []
 },
 "context": {
  "ret_21": -0.15994532701870134,
  "ret_63": -0.14771151894392676,
  "w52_pos": 0.009844124717124876,
  "flow_pct_universe": 98.44741808200378,
  "flow_pct_self": 96.03174603174604,
  "vol_pct_universe": 54.832810867293624,
  "vol_pct_self": 62.698412698412696,
  "net_premium": 1209403.0,
  "volume_ratio": 0.8814569979748741,
  "universe_n": 5829,
  "self_n": 63,
  "sentence": "Direction: no input on this sheet has a measured directional edge at 1\u20134 weeks; the engine emits none.",
  "source": {
   "ret_21": "earnings_history/bars <= 2026-09-18",
   "ret_63": "earnings_history/bars <= 2026-09-18",
   "w52_pos": "earnings_history/bars 252 sessions to 2026-09-18",
   "net_premium": "screener 2026-09-18",
   "volume_ratio": "screener 2026-09-18",
   "flow_pct_universe": "screener universe 2026-09-18",
   "vol_pct_universe": "screener universe 2026-09-18",
   "flow_pct_self": "screener 63 sessions to 2026-09-18",
   "vol_pct_self": "screener 63 sessions to 2026-09-18",
   "sentence": "DESIGN/70 \u00a74F, DECISIONS D3 (frozen 2026-09-20)"
  },
  "nulls": []
 },
 "structures": [],
 "ledger_rows": [],
 "context_read": "sheet_only",
 "inputs_dir": "analyses/ticker/RKT/2026-09-18/inputs",
 "nulls": [
  {
   "field": "events.earnings.confirmed",
   "reason": "the earnings sources disagree on the session: finnhub 2026-10-28 amc, screener 2026-10-29 unknown, yfinance 2026-11-05 None"
  }
 ]
}