{
 "schema": "n1.0",
 "policy_id": "sheet-1.0",
 "ticker": "GRAB",
 "date": "2026-09-18",
 "generated": "2026-09-21T02:54:18+00:00",
 "E": 100000.0,
 "direction": null,
 "liquidity": {
  "can_price": false,
  "failing": "L2",
  "contracts": 186,
  "hot_chain_days": 21,
  "adv_usd": null,
  "atm_spread": null,
  "tier": null,
  "atm_strike": null,
  "atm_expiry": "2026-10-16",
  "verdicts": {
   "L1": true,
   "L2": false,
   "L3": false,
   "L4": true,
   "L5": false,
   "L6": false
  },
  "source": {
   "issue_type": "screener 2026-09-18",
   "close": "screener 2026-09-18",
   "contracts": "daily_contract 2026-09-18",
   "hot_chain_days": "daily_contract 2026-08-20..2026-09-18 (21 sessions)",
   "adv_usd": "prices.parquet 20 sessions to 2026-09-18",
   "atm_spread": "daily_contract late window 2026-09-18",
   "tier": "engine.marking.print_mark late, daily_contract 2026-09-18"
  },
  "nulls": [
   {
    "field": "liquidity.adv_usd",
    "reason": "20-day dollar ADV is null"
   },
   {
    "field": "liquidity.atm_spread",
    "reason": "no ATM pair within 2.5% of 2.795 at 2026-10-16 with 5+ lots on both legs"
   }
  ]
 },
 "events": {
  "earnings": {
   "date": "2026-11-02",
   "session": "unknown",
   "session_date": "2026-11-03",
   "sources": [
    {
     "name": "finnhub",
     "date": "2026-11-02",
     "hour": null
    },
    {
     "name": "screener",
     "date": "2026-11-03",
     "hour": "unknown"
    },
    {
     "name": "yfinance",
     "date": "2026-11-03",
     "hour": null
    }
   ],
   "confirmed": true,
   "days_to": 46
  },
  "ex_div": null,
  "expiries": [
   "2026-09-25",
   "2026-10-02"
  ],
  "macro": [
   {
    "date": "2026-10-28",
    "event": "FOMC"
   }
  ],
  "x1_window_end": "2026-11-03",
  "source": {
   "earnings": "finnhub /calendar/earnings + screener 2026-09-18 + yfinance calendar",
   "ex_div": "screener 2026-09-18",
   "expiries": "cboe_chain 2026-09-18",
   "macro": "FOMC published calendar (engine.name.data.FOMC_DATES)"
  },
  "nulls": [
   {
    "field": "events.ex_div",
    "reason": "screener next_dividend_date is not a date: 'NaT'"
   }
  ]
 },
 "premium": {
  "iv30d": 0.463861204216724,
  "iv_pct_own": 43.75,
  "rv5_21": 34.95544370900535,
  "rv_c2c_21": 34.96227319853184,
  "spread_rv5": 11.43067671266705,
  "spread_c2c": 11.423847223140562,
  "slope": 5.574999999999997,
  "earnings_history": [],
  "median_ratio_8": null,
  "sc": {
   "pass": false,
   "failing": "F2",
   "expiry": null,
   "dte_cal": null,
   "sigma_hold": null,
   "verdicts": {
    "F1": true,
    "F2": false,
    "F3": true,
    "F4": false,
    "F5": null,
    "F6": true,
    "F7": null,
    "F8": null,
    "F9": null
   }
  },
  "sa": null,
  "x1": false,
  "verdict": "RICH",
  "source": {
   "iv30d": "screener 2026-09-18 (a decimal, as the screener carries it)",
   "iv_pct_own": "screener 2026-03-13..2026-09-18 (112 sessions)",
   "rv5_21": "intraday_rv rv5, 21 quality sessions 2026-08-07..2026-09-04 (the panel lags the sheet date)",
   "rv_c2c_21": "daily bars close-to-close, 21 returns 2026-08-20..2026-09-18",
   "spread_rv5": "vol points: 100 x iv30d (screener 2026-09-18) - rv5_21 (intraday_rv rv5, 21 quality sessions 2026-08-07..2026-09-04 (the panel lags the sheet date))",
   "spread_c2c": "vol points: 100 x iv30d (screener 2026-09-18) - rv_c2c_21 (daily bars close-to-close, 21 returns 2026-08-20..2026-09-18)",
   "slope": "cboe_chain 2026-09-18 ATM IV at 2026-09-25 then 2026-10-02, vol points",
   "earnings_history": "earnings_events + earnings_history/events.parquet",
   "sc": "engine.strategies.sc_filters.evaluate_name on SC_PARAMS, daily_contract 2026-09-18",
   "sa": "engine.strategies.sa_filters.cheap_filters on SA_PARAMS, screener 2026-09-18"
  },
  "nulls": []
 },
 "range": {
  "straddle_front": {
   "expiry": "2026-09-25",
   "strike": 3.0,
   "mark": 0.23000000000000004,
   "mark_source": "cboe_chain 2026-09-18",
   "tier": null
  },
  "box_1s_front": 0.23000000000000004,
  "box_1s_21": 0.37169272292072575,
  "atr14": 0.12834820928939836,
  "gex_total": 52426507.078008,
  "gex_sign": "+",
  "zero_gamma": 3.0,
  "zero_gamma_all_crossings": [
   2.0,
   3.0
  ],
  "spot": 2.795,
  "source": {
   "straddle_front": "cboe_chain 2026-09-18",
   "box_1s_front": "cboe_chain 2026-09-18",
   "box_1s_21": "screener 2026-09-18",
   "atr14": "earnings_history/bars <= 2026-09-18",
   "gex_total": "cboe_chain 2026-09-18",
   "gex_sign": "cboe_chain 2026-09-18",
   "zero_gamma": "cboe_chain 2026-09-18",
   "spot": "screener 2026-09-18"
  },
  "nulls": []
 },
 "flags": {
  "borrow": {
   "fee": 0.2782,
   "available": 10000000.0,
   "date": "2026-09-18",
   "decile": 0.2503975378302129,
   "stale_days": 0
  },
  "si": {
   "pct_float": 0.09390000000000001,
   "dtc": null,
   "settlement": null,
   "publication": null,
   "position": null
  },
  "beta_250": 1.4698528508617914,
  "beta_n": 249,
  "analyst": [],
  "analyst_n": 0,
  "form4": {
   "buys": 0,
   "sells": 0,
   "other": 0,
   "rows": []
  },
  "vix": {
   "vix": 14.81,
   "vix3m": 18.24,
   "vxn": 19.29,
   "term": "contango",
   "date": "2026-09-18"
  },
  "regime": "CHOP",
  "regime_asof": "2026-09-04",
  "regime_stale": true,
  "x2": false,
  "x2_reason": null,
  "x5": false,
  "source": {
   "borrow": "borrow (IBKR) 2026-09-18",
   "si": "short_interest (FINRA) settlement None, published None + short float finviz fz quote",
   "beta_250": "earnings_history/bars x SPY 250 sessions to 2026-09-18",
   "analyst": "yfinance upgrades_downgrades <= 2026-09-18",
   "form4": "finnhub /stock/insider-transactions <= 2026-09-18",
   "vix": "index_vol 2026-09-18",
   "regime": "_regime.classify_regime asof 2026-09-04",
   "x2": "borrow (IBKR) 2026-09-18",
   "x5": "short float finviz fz quote"
  },
  "nulls": []
 },
 "context": {
  "ret_21": -0.21045194734101325,
  "ret_63": -0.21708679872295789,
  "w52_pos": 0.014175275390365887,
  "flow_pct_universe": 7.608509178246697,
  "flow_pct_self": 29.365079365079364,
  "vol_pct_universe": 94.50539881574365,
  "vol_pct_self": 94.44444444444444,
  "net_premium": -108097.0,
  "volume_ratio": 1.888896039104478,
  "universe_n": 5829,
  "self_n": 63,
  "sentence": "Direction: no input on this sheet has a measured directional edge at 1\u20134 weeks; the engine emits none.",
  "source": {
   "ret_21": "earnings_history/bars <= 2026-09-18",
   "ret_63": "earnings_history/bars <= 2026-09-18",
   "w52_pos": "earnings_history/bars 252 sessions to 2026-09-18",
   "net_premium": "screener 2026-09-18",
   "volume_ratio": "screener 2026-09-18",
   "flow_pct_universe": "screener universe 2026-09-18",
   "vol_pct_universe": "screener universe 2026-09-18",
   "flow_pct_self": "screener 63 sessions to 2026-09-18",
   "vol_pct_self": "screener 63 sessions to 2026-09-18",
   "sentence": "DESIGN/70 \u00a74F, DECISIONS D3 (frozen 2026-09-20)"
  },
  "nulls": []
 },
 "structures": [],
 "ledger_rows": [],
 "context_read": "sheet_only",
 "inputs_dir": "analyses/ticker/GRAB/2026-09-18/inputs",
 "nulls": [
  {
   "field": "adv_usd_20d",
   "reason": "fewer than 10 priced sessions for GRAB"
  },
  {
   "field": "earnings_events",
   "reason": "no earnings_events rows for GRAB"
  },
  {
   "field": "earnings_history",
   "reason": "no earnings_history rows for GRAB"
  },
  {
   "field": "short_interest",
   "reason": "no FINRA row for GRAB; short float only"
  },
  {
   "field": "liquidity.adv_usd",
   "reason": "20-day dollar ADV is null"
  },
  {
   "field": "liquidity.atm_spread",
   "reason": "no ATM pair within 2.5% of 2.795 at 2026-10-16 with 5+ lots on both legs"
  },
  {
   "field": "events.ex_div",
   "reason": "screener next_dividend_date is not a date: 'NaT'"
  }
 ]
}