{
 "schema": "n1.0",
 "policy_id": "sheet-1.0",
 "ticker": "SMH",
 "date": "2026-10-02",
 "generated": "2026-10-12T19:33:11+00:00",
 "E": 100000.0,
 "direction": null,
 "liquidity": {
  "can_price": false,
  "failing": "L6",
  "contracts": 2306,
  "hot_chain_days": 21,
  "adv_usd": 3769767338.3502197,
  "atm_spread": null,
  "tier": null,
  "atm_strike": null,
  "atm_expiry": "2026-10-30",
  "verdicts": {
   "L1": true,
   "L2": true,
   "L3": true,
   "L4": true,
   "L5": true,
   "L6": false
  },
  "source": {
   "issue_type": "screener 2026-10-02",
   "close": "screener 2026-10-02",
   "contracts": "daily_contract 2026-10-02",
   "hot_chain_days": "daily_contract 2026-09-03..2026-10-02 (21 sessions)",
   "adv_usd": "prices.parquet 20 sessions to 2026-10-02",
   "atm_spread": "daily_contract late window 2026-10-02",
   "tier": "engine.marking.print_mark late, daily_contract 2026-10-02"
  },
  "nulls": [
   {
    "field": "liquidity.atm_spread",
    "reason": "no ATM pair within 2.5% of 630.6 at 2026-10-30 with 5+ lots on both legs"
   }
  ]
 },
 "events": {
  "earnings": {
   "date": null,
   "session": null,
   "session_date": null,
   "sources": [
    {
     "name": "finnhub",
     "date": null,
     "hour": null
    },
    {
     "name": "screener",
     "date": null,
     "hour": null
    },
    {
     "name": "yfinance",
     "date": null,
     "hour": null
    }
   ],
   "confirmed": false,
   "days_to": null
  },
  "ex_div": null,
  "expiries": [
   "2026-10-09",
   "2026-10-12"
  ],
  "macro": [
   {
    "date": "2026-10-28",
    "event": "FOMC"
   }
  ],
  "x1_window_end": "2026-11-16",
  "source": {
   "earnings": "finnhub /calendar/earnings + screener 2026-10-02 + yfinance calendar",
   "ex_div": "screener 2026-10-02",
   "expiries": "cboe_chain 2026-10-02",
   "macro": "FOMC published calendar (engine.name.data.FOMC_DATES)"
  },
  "nulls": [
   {
    "field": "events.earnings.date",
    "reason": "finnhub /calendar/earnings: no print scheduled on or after 2026-10-02"
   },
   {
    "field": "events.ex_div",
    "reason": "screener next_dividend_date is not a date: 'NaT'"
   }
  ]
 },
 "premium": {
  "iv30d": 0.332016473263119,
  "iv_pct_own": 10.655737704918032,
  "rv5_21": 18.997949870024108,
  "rv_c2c_21": 29.792886006667228,
  "spread_rv5": 14.203697456287792,
  "spread_c2c": 3.4087613196446718,
  "slope": -1.7600000000000005,
  "earnings_history": [],
  "median_ratio_8": null,
  "sc": {
   "pass": false,
   "failing": "F1",
   "expiry": null,
   "dte_cal": null,
   "sigma_hold": null,
   "verdicts": {
    "F1": false,
    "F2": true,
    "F3": false,
    "F4": true,
    "F5": null,
    "F6": true,
    "F7": null,
    "F8": null,
    "F9": null
   }
  },
  "sa": null,
  "x1": false,
  "verdict": "RICH",
  "source": {
   "iv30d": "screener 2026-10-02 (a decimal, as the screener carries it)",
   "iv_pct_own": "screener 2026-03-13..2026-10-02 (122 sessions)",
   "rv5_21": "intraday_rv rv5, 21 quality sessions 2026-09-03..2026-10-02 (the panel lags the sheet date)",
   "rv_c2c_21": "daily bars close-to-close, 21 returns 2026-09-03..2026-10-02",
   "spread_rv5": "vol points: 100 x iv30d (screener 2026-10-02) - rv5_21 (intraday_rv rv5, 21 quality sessions 2026-09-03..2026-10-02 (the panel lags the sheet date))",
   "spread_c2c": "vol points: 100 x iv30d (screener 2026-10-02) - rv_c2c_21 (daily bars close-to-close, 21 returns 2026-09-03..2026-10-02)",
   "slope": "cboe_chain 2026-10-02 ATM IV at 2026-10-09 then 2026-10-12, vol points",
   "earnings_history": "earnings_events + earnings_history/events.parquet",
   "sc": "engine.strategies.sc_filters.evaluate_name on SC_PARAMS, daily_contract 2026-10-02",
   "sa": "engine.strategies.sa_filters.cheap_filters on SA_PARAMS, screener 2026-10-02"
  },
  "nulls": []
 },
 "range": {
  "straddle_front": {
   "expiry": "2026-10-09",
   "strike": 630.0,
   "mark": 17.35,
   "mark_source": "cboe_chain 2026-10-02",
   "tier": null
  },
  "box_1s_front": 17.35,
  "box_1s_21": 60.02439531175335,
  "atr14": 15.30443391726792,
  "gex_total": 111348660.48749998,
  "gex_sign": "+",
  "zero_gamma": 625.0,
  "zero_gamma_all_crossings": [
   625.0
  ],
  "spot": 630.6,
  "source": {
   "straddle_front": "cboe_chain 2026-10-02",
   "box_1s_front": "cboe_chain 2026-10-02",
   "box_1s_21": "screener 2026-10-02",
   "atr14": "earnings_history/bars <= 2026-10-02",
   "gex_total": "cboe_chain 2026-10-02",
   "gex_sign": "cboe_chain 2026-10-02",
   "zero_gamma": "cboe_chain 2026-10-02",
   "spot": "screener 2026-10-02"
  },
  "nulls": []
 },
 "flags": {
  "borrow": {
   "fee": 0.5329,
   "available": 2600000.0,
   "date": "2026-10-02",
   "decile": 0.42239378342920575,
   "stale_days": 0
  },
  "si": {
   "pct_float": null,
   "dtc": 1.88,
   "settlement": "2026-09-15",
   "publication": "2026-09-28",
   "position": 12342349.0
  },
  "beta_250": 2.3630603713580736,
  "beta_n": 249,
  "analyst": [],
  "analyst_n": 0,
  "form4": {
   "buys": 0,
   "sells": 0,
   "other": 0,
   "rows": []
  },
  "vix": {
   "vix": 15.31,
   "vix3m": 18.01,
   "vxn": 21.2,
   "term": "contango",
   "date": "2026-10-02"
  },
  "regime": "CHOP",
  "regime_asof": "2026-10-02",
  "regime_stale": false,
  "x2": false,
  "x2_reason": null,
  "x5": false,
  "source": {
   "borrow": "borrow (IBKR) 2026-10-02",
   "si": "short_interest (FINRA) settlement 2026-09-15, published 2026-09-28 + short float n/a",
   "beta_250": "earnings_history/bars x SPY 250 sessions to 2026-10-02",
   "analyst": "yfinance upgrades_downgrades <= 2026-10-02",
   "form4": "finnhub /stock/insider-transactions <= 2026-10-02",
   "vix": "index_vol 2026-10-02",
   "regime": "_regime.classify_regime asof 2026-10-02",
   "x2": "borrow (IBKR) 2026-10-02",
   "x5": "short float None"
  },
  "nulls": [
   {
    "field": "si.pct_float",
    "reason": "Short Float/Short Ratio/Short Interest absent from fz quote's fundamentals grid (known fz regression, see module docstring); yfinance info shortPercentOfFloat: shortPercentOfFloat absent"
   },
   {
    "field": "x5",
    "reason": "X5 cannot fire on a missing short float: it is unevaluated, not passed"
   }
  ]
 },
 "context": {
  "ret_21": 0.1455457018599713,
  "ret_63": 0.04352141043229518,
  "w52_pos": 0.8844384827672097,
  "flow_pct_universe": 99.44186845268761,
  "flow_pct_self": 57.93650793650794,
  "vol_pct_universe": 77.27589208006962,
  "vol_pct_self": 84.92063492063492,
  "net_premium": 3509741.0,
  "volume_ratio": 1.1076623533542873,
  "universe_n": 5823,
  "self_n": 63,
  "sentence": "Direction: no input on this sheet has a measured directional edge at 1\u20134 weeks; the engine emits none.",
  "source": {
   "ret_21": "earnings_history/bars <= 2026-10-02",
   "ret_63": "earnings_history/bars <= 2026-10-02",
   "w52_pos": "earnings_history/bars 252 sessions to 2026-10-02",
   "net_premium": "screener 2026-10-02",
   "volume_ratio": "screener 2026-10-02",
   "flow_pct_universe": "screener universe 2026-10-02",
   "vol_pct_universe": "screener universe 2026-10-02",
   "flow_pct_self": "screener 63 sessions to 2026-10-02",
   "vol_pct_self": "screener 63 sessions to 2026-10-02",
   "sentence": "DESIGN/70 \u00a74F, DECISIONS D3 (frozen 2026-09-20)"
  },
  "nulls": []
 },
 "structures": [],
 "ledger_rows": [],
 "context_read": "none",
 "inputs_dir": "analyses/ticker/SMH/2026-10-02/inputs",
 "nulls": [
  {
   "field": "earnings_events",
   "reason": "no earnings_events rows for SMH"
  },
  {
   "field": "earnings_history",
   "reason": "no earnings_history rows for SMH"
  },
  {
   "field": "short_interest.short_float",
   "reason": "Short Float/Short Ratio/Short Interest absent from fz quote's fundamentals grid (known fz regression, see module docstring); yfinance info shortPercentOfFloat: shortPercentOfFloat absent"
  },
  {
   "field": "earnings_dates.finnhub",
   "reason": "finnhub /calendar/earnings: no print scheduled on or after 2026-10-02"
  },
  {
   "field": "earnings_dates.yfinance",
   "reason": "yfinance calendar: no Earnings Date in the calendar block"
  },
  {
   "field": "liquidity.atm_spread",
   "reason": "no ATM pair within 2.5% of 630.6 at 2026-10-30 with 5+ lots on both legs"
  },
  {
   "field": "events.earnings.date",
   "reason": "finnhub /calendar/earnings: no print scheduled on or after 2026-10-02"
  },
  {
   "field": "events.ex_div",
   "reason": "screener next_dividend_date is not a date: 'NaT'"
  },
  {
   "field": "flags.si.pct_float",
   "reason": "Short Float/Short Ratio/Short Interest absent from fz quote's fundamentals grid (known fz regression, see module docstring); yfinance info shortPercentOfFloat: shortPercentOfFloat absent"
  },
  {
   "field": "flags.x5",
   "reason": "X5 cannot fire on a missing short float: it is unevaluated, not passed"
  }
 ]
}